"--- Welcome to Employee Payroll  Program On MySQL DB "
------------------------------------------------------------------------
UC1--> Create a database Payroll_service and Show and Used that data base
------------------------------------------------------------------------
mysql> CREATE DATABASE payroll_service;
Query OK, 1 row affected (0.00 sec)

mysql> show databases;
+--------------------+
| Database           |
+--------------------+
| information_schema |
| demo               |
| mysql              |
| payroll_service    |
| student            |
| test               |
| testmango          |
+--------------------+
7 rows in set (0.00 sec)

mysql> USE payroll_service;
Database changed
mysql> SELECT DATABASE();
+-----------------+
| DATABASE()      |
+-----------------+
| payroll_service |
+-----------------+
1 row in set (0.00 sec)

-----------------------------------------------------------------------
UC2-->Create a Table inside the Payroll database
-----------------------------------------------------------------------

mysql> CREATE TABLE employee_payroll
    -> (
    ->    id            INT unsigned NOT NULL Auto_INCREMENT,
    ->    name          VARCHAR(150) NOT NULL,
    ->    salary        Double NOT NULL,
    ->    start         DATE NOT NULL,
    ->    PRIMARY KEY   (id)
    -> );
Query OK, 0 rows affected (0.06 sec)

mysql> DESCRIBE employee_payroll;
+--------+------------------+------+-----+---------+----------------+
| Field  | Type             | Null | Key | Default | Extra          |
+--------+------------------+------+-----+---------+----------------+
| id     | int(10) unsigned | NO   | PRI | NULL    | auto_increment |
| name   | varchar(150)     | NO   |     | NULL    |                |
| salary | double           | NO   |     | NULL    |                |
| start  | date             | NO   |     | NULL    |                |
+--------+------------------+------+-----+---------+----------------+
4 rows in set (0.03 sec)

--------------------------------------------------------------------
UC3--> Inserting dat into a EmployeePayroll table
--------------------------------------------------------------------

mysql> insert into employee_payroll(name,salary,start)values
    -> ( 'Vishu', 1000000.00, '2018-01-03' ),
    -> ( 'Ashu' , 2000000.00, '2019-11-13' ),
    -> ( 'Akshu', 3000000.00, '2020-05-21' );
Query OK, 3 rows affected (0.02 sec)
Records: 3  Duplicates: 0  Warnings: 0

----------------------------------------------------
UC4--> Retrieve the data Employee_payroll data
----------------------------------------------------

mysql>  SELECT * FROM employee_payroll;
+----+-------+---------+------------+
| id | name  | salary  | start      |
+----+-------+---------+------------+
|  1 | Vishu | 1000000 | 2018-01-03 |
|  2 | Ashu  | 2000000 | 2019-11-13 |
|  3 | Akshu | 3000000 | 2020-05-21 |
+----+-------+---------+------------+
3 rows in set (0.01 sec)

--------------------------------------------------------------
UC5-->Ability to retrieve salary data for particular employee
---------------------------------------------------------------

mysql> select salary from employee_payroll where name = 'Vishu';
+---------+
| salary  |
+---------+
| 1000000 |
+---------+
1 row in set (0.00 sec)

mysql> select * from employee_payroll where start between cast('2019-01-01' as date) and date (now());
+----+-------+---------+------------+
| id | name  | salary  | start      |
+----+-------+---------+------------+
|  2 | Ashu  | 2000000 | 2019-11-13 |
|  3 | Akshu | 3000000 | 2020-05-21 |
+----+-------+---------+------------+
2 rows in set (0.00 sec)

mysql>  select * from employee_payroll where start between cast('2020-01-01' as date) and date (now());
+----+-------+---------+------------+
| id | name  | salary  | start      |
+----+-------+---------+------------+
|  3 | Akshu | 3000000 | 2020-05-21 |
+----+-------+---------+------------+
1 row in set (0.00 sec)

-----------------------------------------------------------------------
UC6-->Ability to add gender to employee
------------------------------------------------------------------------

mysql> alter table employee_payroll add gender char(1) after name;
Query OK, 3 rows affected (0.05 sec)
Records: 3  Duplicates: 0  Warnings: 0

mysql> describe employee_payroll;
+--------+------------------+------+-----+---------+----------------+
| Field  | Type             | Null | Key | Default | Extra          |
+--------+------------------+------+-----+---------+----------------+
| id     | int(10) unsigned | NO   | PRI | NULL    | auto_increment |
| name   | varchar(150)     | NO   |     | NULL    |                |
| gender | char(1)          | YES  |     | NULL    |                |
| salary | double           | NO   |     | NULL    |                |
| start  | date             | NO   |     | NULL    |                |
+--------+------------------+------+-----+---------+----------------+
5 rows in set (0.01 sec)

mysql> update employee_payroll set gender ='F' where name ='Vishu' or name='Ashu';
Query OK, 2 rows affected (0.01 sec)
Rows matched: 2  Changed: 2  Warnings: 0

mysql> update employee_payroll set gender ='F' where name ='Akshu';
Query OK, 1 row affected (0.00 sec)
Rows matched: 1  Changed: 1  Warnings: 0

mysql> select * from employee_payroll;
+----+-------+--------+---------+------------+
| id | name  | gender | salary  | start      |
+----+-------+--------+---------+------------+
|  1 | Vishu | F      | 1000000 | 2018-01-03 |
|  2 | Ashu  | F      | 2000000 | 2019-11-13 |
|  3 | Akshu | F      | 3000000 | 2020-05-21 |
+----+-------+--------+---------+------------+
3 rows in set (0.00 sec)

-------------------------------------------------------------------
UC7-->Ability to find sum,avg,min,max and number of females
-------------------------------------------------------------------

mysql> select sum(salary) from employee_payroll where gender ='F' group by gender;
+-------------+
| sum(salary) |
+-------------+
|     6000000 |
+-------------+
1 row in set (0.01 sec)

mysql>  select avg(salary) from employee_payroll where gender ='F' group by gender;
+-------------+
| avg(salary) |
+-------------+
|     2000000 |
+-------------+
1 row in set (0.00 sec)

mysql>  select max(salary) from employee_payroll where gender ='F' group by gender;
+-------------+
| max(salary) |
+-------------+
|     3000000 |
+-------------+
1 row in set (0.00 sec)

mysql> select gender , avg(salary) from employee_payroll group by gender;
+--------+-------------+
| gender | avg(salary) |
+--------+-------------+
| F      |     2000000 |
+--------+-------------+
1 row in set (0.01 sec)

mysql> select gender , count(name) from employee_payroll group by gender;
+--------+-------------+
| gender | count(name) |
+--------+-------------+
| F      |           3 |
+--------+-------------+
1 row in set (0.00 sec)

------------------------------------------------------------------------------------------------------------------------
UC8-->Ability to extend employee_payroll data to store employee information like employee phone, address and department
-------------------------------------------------------------------------------------------------------------------------

mysql> alter table employee_payroll add phoneNumber varchar(30) after name;
Query OK, 0 rows affected (0.42 sec)
Records: 0  Duplicates: 0  Warnings: 0

mysql> alter table employee_payroll add address varchar(250) after PhoneNumber;
Query OK, 0 rows affected (0.04 sec)
Records: 0  Duplicates: 0  Warnings: 0

mysql>  alter table employee_payroll add department varchar(250) not null after address;
Query OK, 0 rows affected (0.03 sec)
Records: 0  Duplicates: 0  Warnings: 0

mysql> alter table employee_payroll alter address set default 'ATP';
Query OK, 0 rows affected (0.02 sec)
Records: 0  Duplicates: 0  Warnings: 0

mysql> describe employee_payroll;
+-------------+--------------+------+-----+---------+----------------+
| Field       | Type         | Null | Key | Default | Extra          |
+-------------+--------------+------+-----+---------+----------------+
| id          | int unsigned | NO   | PRI | NULL    | auto_increment |
| name        | varchar(150) | NO   |     | NULL    |                |
| phoneNumber | varchar(30)  | YES  |     | NULL    |                |
| address     | varchar(250) | YES  |     | ATP     |                |
| department  | varchar(250) | NO   |     | NULL    |                |
| gender      | char(1)      | YES  |     | NULL    |                |
| salary      | double       | NO   |     | NULL    |                |
| start       | date         | NO   |     | NULL    |                |
+-------------+--------------+------+-----+---------+----------------+
8 rows in set (0.06 sec)

mysql> update  employee_payroll set address=default;
Query OK, 3 rows affected (0.01 sec)
Rows matched: 3  Changed: 3  Warnings: 0

mysql> select * from employee_payroll;
+----+-------+-------------+---------+------------+--------+---------+------------+
| id | name  | phoneNumber | address | department | gender | salary  | start      |
+----+-------+-------------+---------+------------+--------+---------+------------+
|  1 | Vishu | NULL        | ATP     |            | F      | 1000000 | 2018-01-03 |
|  2 | Ashu  | NULL        | ATP     |            | F      | 2000000 | 2019-11-13 |
|  3 | Akshu | NULL        | ATP     |            | F      | 3000000 | 2020-05-21 |
+----+-------+-------------+---------+------------+--------+---------+------------+
3 rows in set (0.00 sec)

--------------------------------------------------------------------------------------------------------------
UC9-->Ability to extend  employee_payroll table to have Basic Pay,Deductions, Taxable Pay,Income Tax, Net Pay
-------------------------------------------------------------------------------------------------------------

mysql> alter table employee_payroll  rename column salary to BasicPay;
Query OK, 0 rows affected (0.43 sec)
Records: 0  Duplicates: 0  Warnings: 0

mysql> alter table employee_payroll  add Deduction double not null after BasicPay;
Query OK, 0 rows affected (0.03 sec)
Records: 0  Duplicates: 0  Warnings: 0

mysql> alter table employee_payroll  add TaxablePay double not null after Deduction;
Query OK, 0 rows affected (0.03 sec)
Records: 0  Duplicates: 0  Warnings: 0

mysql>  alter table employee_payroll  add NetPay double not null after TaxablePay;
Query OK, 0 rows affected (0.03 sec)
Records: 0  Duplicates: 0  Warnings: 0

mysql>  alter table employee_payroll  add Tax double not null after netpay;
Query OK, 0 rows affected (0.03 sec)
Records: 0  Duplicates: 0  Warnings: 0

mysql>  describe employee_payroll;
+-------------+--------------+------+-----+---------+----------------+
| Field       | Type         | Null | Key | Default | Extra          |
+-------------+--------------+------+-----+---------+----------------+
| id          | int unsigned | NO   | PRI | NULL    | auto_increment |
| name        | varchar(150) | NO   |     | NULL    |                |
| phoneNumber | varchar(30)  | YES  |     | NULL    |                |
| address     | varchar(250) | YES  |     | ATP     |                |
| department  | varchar(250) | NO   |     | NULL    |                |
| gender      | char(1)      | YES  |     | NULL    |                |
| BasicPay    | double       | NO   |     | NULL    |                |
| Deduction   | double       | NO   |     | NULL    |                |
| TaxablePay  | double       | NO   |     | NULL    |                |
| NetPay      | double       | NO   |     | NULL    |                |
| Tax         | double       | NO   |     | NULL    |                |
| start       | date         | NO   |     | NULL    |                |
+-------------+--------------+------+-----+---------+----------------+
12 rows in set (0.11 sec)

----------------------------------------------------------------------
UC10-->Ability to make Vishu as part of Sales and Marketing Department
----------------------------------------------------------------------

mysql> insert into employee_payroll(name,department,gender,Basicpay,deduction,taxablepay,netpay,tax,start)values
    -> ('Vishu','Sales','F','500000','10000','20000','10000','10000','2019-05-23');
Query OK, 1 row affected (0.04 sec)

mysql> select * from employee_payroll where name ='Vishu';
+----+-------+-------------+---------+------------+--------+----------+-----------+------------+--------+-------+------------+
| id | name  | phoneNumber | address | department | gender | BasicPay | Deduction | TaxablePay | NetPay | Tax   | start      |
+----+-------+-------------+---------+------------+--------+----------+-----------+------------+--------+-------+------------+
|  1 | Vishu | NULL        | ATP     |            | F      |  1000000 |         0 |          0 |      0 |     0 | 2018-01-03 |
|  4 | Vishu | NULL        | ATP     | Sales      | F      |   500000 |     10000 |      20000 |  10000 | 10000 | 2019-05-23 |
+----+-------+-------------+---------+------------+--------+----------+-----------+------------+--------+-------+------------+
2 rows in set (0.01 sec)


